{
  "schema_version": 1,
  "units": "m",
  "convention": "c",
  "name": "s",
  "model_type": "smplx",
  "model_file": "SMPLX_MALE.npz",
  "gender": "male",
  "betas": [
    0.1,
    0.2
  ],
  "num_betas_requested": 30,
  "num_betas_used": 30,
  "target_cm": {
    "height": 173
  },
  "achieved_cm": {
    "height": 173.0
  },
  "mesh": "avatar.obj",
  "files": {
    "bounding_volumes": "bounding_volumes.json",
    "arrangement_points": "arrangement_points.json",
    "measurements_report": "measurements_report.json"
  },
  "bbox_m": {
    "min": [
      -1,
      0,
      -0.2
    ],
    "max": [
      1,
      1.73,
      0.2
    ]
  },
  "engine_version": "0.1.0"
}
